firebase_id,name,bio,birth_date,death_date,nationality,job,image_url,website_url,wikipedia_url,is_fictional,views_count,quotes_count,created_at,updated_at
"OJmFW46CMX0MVSVLTDeL","Nina's grandfather","Nina's grandfather comes to Japan with his granddaughter, as she has her pianist concert.","","","","","","","","true","","","2023-09-12T23:47:19.890Z","2023-09-12T23:47:19.890Z"
"OcBbFGjDZH5fTG1gu7LI","Norman Vincent Peale","Norman Vincent Peale was an American minister and author known for his work in popularizing the concept of positive thinking, especially through his best-selling book The Power of Positive Thinking.","","","","American minister","https://upload.wikimedia.org/wikipedia/commons/9/9d/Norman_Vincent_Peale_NYWTS.jpg","","https://en.wikipedia.org/wiki/Norman_Vincent_Peale","","","","2023-09-12T23:47:19.923Z","2023-09-12T23:47:19.923Z"
"Oq5cx5YG03WwNNWYzXLm","Leonardo da Vinci","Leonardo di ser Piero da Vinci, known as Leonardo da Vinci, was an Italian polymath of the Renaissance whose areas of interest included invention, drawing, painting, sculpture, architecture, science, music, mathematics, engineering, literature, anatomy, geology, astronomy, botany, paleontology, and cartography. ","","","","Polymath","https://upload.wikimedia.org/wikipedia/commons/c/cb/Francesco_Melzi_-_Portrait_of_Leonardo.png","","https://en.wikipedia.org/wiki/Leonardo_da_Vinci","","","","2023-09-12T23:47:19.956Z","2023-09-12T23:47:19.956Z"
"PPTCZV445yFnI3RoHcH3","Jonathan Kozol","Jonathan Kozol is an American writer, educator, and activist, best known for his books on public education in the United States.","","","","","","https://en.wikipedia.org/wiki/Jonathan_Kozol","https://en.wikipedia.org/wiki/Jonathan_Kozol","","","","2023-09-12T23:47:19.989Z","2023-09-12T23:47:19.989Z"
"PTzBG9wWQ28qMJCHydTE","Chikaro","Chikaro is a japanese researcher who has a conversation with Maëlle in a forest in Nepal.","2024-01-19T18:22:52.769Z","2024-01-17T10:43:35.183Z","","Japanese researcher","","","","true","","","2024-01-19T18:22:58.716Z","2024-01-19T18:22:58.717Z"
"PbiLWvGKygkjMYF8ZK4h","Cédric Ingrand","Cédric Ingrand is a french journalist working in the field of Internet and technologies. He hosts ""Plein Écran"" on the french channel LCI.  he also takes part in various prpgrams such as ""Les coulisses de l'économie"" on TF1, ""Le Rendez-vous Tech"" or ""On Refait le Mac"".","","","","French journalist","https://firebasestorage.googleapis.com/v0/b/memorare-98eee.appspot.com/o/images%2Fpp%2FCédric Ingrand-1604420315283.jpg?alt=media","https://medium.com/@cedric","https://fr.wikipedia.org/wiki/C%C3%A9dric_Ingrand","","","","2023-09-12T23:47:20.022Z","2023-09-12T23:47:20.022Z"
"PrE7WFW0wMEmWqDPJgjs","St. Jean-Baptiste-Marie Vianney","Jean-Baptiste-Marie Vianney, T.O.S.F., commonly known in English as Saint John Vianney, was a French parish priest who is venerated in the Catholic Church as a saint and as the patron saint of parish priests.","","","","Catholic saint","https://upload.wikimedia.org/wikipedia/commons/3/34/Johnvianney.jpg","","https://en.wikipedia.org/wiki/John_Vianney","","","","2023-09-12T23:47:20.054Z","2023-09-12T23:47:20.054Z"
"Pvvm1Bnj4JWvZPwEymx1","Reynolds Woodcock","Reynolds Woodcock is a fictional character played by Daniel Day-Lewis in the film Phantom Thread. In the film, he creates dresses for members of high society, even royalty. His clients view him as a genius whose creations enable them to become their best selves; but his creativity and charm are matched by his obsessive and controlling personality.","","","","Dress designer","https://firebasestorage.googleapis.com/v0/b/memorare-98eee.appspot.com/o/images%2Fpp%2FReynolds Woodcock-1614102104454.jpg?alt=media","","https://www.wikiwand.com/en/Daniel_Day-Lewis","true","","","2023-09-12T23:47:20.092Z","2023-09-12T23:47:20.092Z"
"Q3lCFPelRrNKONEcrUDy","Jesus","Jesus, also referred to as Jesus of Nazareth or Jesus Christ, was a first-century Jewish preacher and religious leader. He is the central figure of Christianity. Most Christians believe he is the incarnation of God the Son and the awaited Messiah (the Christ) prophesied in the Old Testament.","","","","Preacher","https://upload.wikimedia.org/wikipedia/commons/6/63/Cefal%C3%B9_Pantocrator_retouched.jpg","","https://en.wikipedia.org/wiki/Jesus","","","","2023-09-12T23:47:20.124Z","2023-09-12T23:47:20.124Z"
"Q5a4lYtWfeVC3eWn5IiG","Arthur Ashe","Arthur Robert Ashe Jr. was an American professional tennis player who won three Grand Slam titles. Ashe was the first black player selected to the United States Davis Cup team and the only black man ever to win the singles title at Wimbledon, the US Open, and the Australian Open. He retired in 1980.","","","","American tennis player","https://upload.wikimedia.org/wikipedia/commons/6/60/Arthur_Ashe_%28cropped%29.jpg","","https://en.wikipedia.org/wiki/Arthur_Ashe","","","","2023-09-12T23:47:20.173Z","2023-09-12T23:47:20.173Z"
"QKTKFWmnS3BTOaKBrInE","Travis","Travis is a widower whose daughter goes to the same school as Marah and finds a connection with Kate","2021-03-14T23:24:56.288Z","2021-03-14T23:24:56.288Z","","Dad","https://firebasestorage.googleapis.com/v0/b/memorare-98eee.appspot.com/o/images%2Fpp%2FTravis-1619988513007.jpg?alt=media","","https://en.wikipedia.org/wiki/Brandon_Jay_McLaren","true","","","2023-09-12T23:47:20.208Z","2023-09-12T23:47:20.208Z"
"QMTHoNJTzRyEDZT0A4kZ","Roger Staubach","Roger Thomas Staubach, nicknamed ""Roger the Dodger"", ""Captain America"" and ""Captain Comeback"", is an American former professional football player who was a quarterback for the Dallas Cowboys in the National Football League.","","","","American football player","https://upload.wikimedia.org/wikipedia/commons/f/f5/Staubach_cowboys_qb.jpg","","https://en.wikipedia.org/wiki/Roger_Staubach","","","","2023-09-12T23:47:20.262Z","2023-09-12T23:47:20.262Z"
"QOOxkQ74Xclae4peu4F4","Japanese Proverb","","","","","","","","","","","","2023-09-12T23:47:20.296Z","2023-09-12T23:47:20.296Z"
"QVmvnv8eDJzfe8HgWlvW","Mary Whitney","Mary Whitney is a fictional character, a maid, and friend of Grace Marks. Mary believes in herself and in Canada as a place that a hard working girl can earn her way. She plans to save her wages for a dowry so she can marry a farmer and be mistress of her own home. She's played by  Rebecca Liddiard in the miniserie.","2021-05-04T18:24:24.935Z","2021-05-04T18:24:24.935Z","","Maid","https://firebasestorage.googleapis.com/v0/b/memorare-98eee.appspot.com/o/images%2Fpp%2FMary Whitney-1620483586526.jpg?alt=media","","https://en.wikipedia.org/wiki/Rebecca_Liddiard","true","","","2023-09-12T23:47:20.330Z","2023-09-12T23:47:20.330Z"
"QWdCOAogqJgcPbHSvWNs","Albus Dumbledore","Prof. Albus Percival Wulfric Brian Dumbledor is a fictional character in the Harry Potter series of novels by J. K. Rowling. For most of the series, he is the headmaster of the wizarding school Hogwarts. As part of his backstory, it is revealed that he is the founder and leader of the Order of the Phoenix, an organisation dedicated to fighting the Dark wizard Lord Voldemort.","2024-07-22T14:30:20.651Z","2024-07-22T14:24:28.976Z","","","https://firebasestorage.googleapis.com/v0/b/memorare-98eee.appspot.com/o/images%2Fpp%2FAlbus-Dumbledore--1721658633329.jpg?alt=media","","https://en.m.wikipedia.org/wiki/Albus_Dumbledore","true","","","2024-07-22T14:30:27.940Z","2024-07-22T14:30:27.940Z"
"Qm6jiyyNlCpBWLDZ3dy9","Billy Alsbrooks","Billy Alsbrooks, Jr., better known by his stage name White Dawg, is an American rapper and record producer.","","","","","","https://en.wikipedia.org/wiki/White_Dawg","https://en.wikipedia.org/wiki/White_Dawg","","","","2023-09-12T23:47:20.364Z","2023-09-12T23:47:20.364Z"
"QmvFpHzl41l0WynozQRd","Herbert Zucker","Herbert Zucker is a fictional character played by Steve Witting in the TV miniseries The Outsider. He is a psychologist who has the detective Ralph as a patient.","","","","Psychologist","https://firebasestorage.googleapis.com/v0/b/memorare-98eee.appspot.com/o/images%2Fpp%2FSteve-Witting.jpg?alt=media&token=4f57ada6-5011-4722-9d1b-65f0550b3a65","","https://en.wikipedia.org/wiki/Steve_Witting","","","","2023-09-12T23:47:20.398Z","2023-09-12T23:47:20.398Z"
"QxFzySxBMhPFN74pOkHX","Claude Bolton","Claude Bolton is a fictional character played by Paddy Considine in the TV miniseries The Outsider. He's a bouncer at the Peach Crease night club.","","","","Bouncer","https://upload.wikimedia.org/wikipedia/commons/d/d3/Paddy_Considine_at_the_%22Tyrannosaur%22_Q%26A_at_the_Quad_in_Derby_%286202793361%29.jpg","","https://en.wikipedia.org/wiki/Paddy_Considine","","","","2023-09-12T23:47:20.430Z","2023-09-12T23:47:20.430Z"
"Qy8v22kQVIO0EvQNwUQd","Dan Broderick","Dan Broderick is a fictional character played by Christian Slater in the TV series ""Dirty Jonh"". In the show, he's a lawyer specialized in pursuing medical malpactrices. He's married to Betty and has four children.","","","","Lawyer","https://firebasestorage.googleapis.com/v0/b/memorare-98eee.appspot.com/o/images%2Fpp%2FDan Broderick-1604439846183.jpg?alt=media","","https://en.wikipedia.org/wiki/Christian_Slater","true","","","2023-09-12T23:47:20.464Z","2023-09-12T23:47:20.464Z"
"REoE0IDoSiddgj4ioS4P","Joseph Ignace Guillotin","Joseph Ignace Guillotin is a fictional character played by Amir El Kacem in the TV series ""La Révolution"". In the shows, he's a physician (medical doctor) investigating mysterious deaths and disparitions. Although fictional, this character truly existed between 28 May 1738 – 26 March 1814.","","","","Physician","https://firebasestorage.googleapis.com/v0/b/memorare-98eee.appspot.com/o/images%2Fpp%2FJoseph Ignace Guillotin-1604324182463.jpg?alt=media","","https://en.wikipedia.org/wiki/Joseph-Ignace_Guillotin","true","","","2023-09-12T23:47:20.498Z","2023-09-12T23:47:20.498Z"
"RNch5RL8IYReLFtCUY0M","Esty","Esther ""Esty"" Shapiro is a fictional character played by Shira Haas in the miniseries ""Unorthodox"". In the miniseries, she's a 19-year-old Jewish woman who runs away from her arranged marriage and Ultra-Orthodox community in Williamsburg, Brooklyn, New York City. She moves to Berlin, where her estranged mother lives, and tries to navigate a secular life and take classes at a music conservatory.","","","","Housewife","https://upload.wikimedia.org/wikipedia/commons/8/8c/Shira_Haas_at_Warsaw_Zoo_%28cropped%29.png","","https://en.wikipedia.org/wiki/Shira_Haas","","","","2023-09-12T23:47:20.531Z","2023-09-12T23:47:20.531Z"
"RYd2wQpPkbk3ETjDe8vm","Vasily Borgov","Vasily Borgov is a fictional character played by Marcin Dorociński in the TV miniseries The Queen's Gambit. In the show, he's the current Soviet-Russian world champion chess player and Beth's strongest competitor.","","","","World champion chess player","https://firebasestorage.googleapis.com/v0/b/memorare-98eee.appspot.com/o/images%2Fpp%2FVasily Borgov-1607039449410.jpg?alt=media","","https://en.wikipedia.org/wiki/Marcin_Doroci%C5%84ski","true","","","2023-09-12T23:47:20.586Z","2023-09-12T23:47:20.586Z"
"RbeJkaUOPDmTleYs5dxX","Joshua J. Marine","","","","","","https://qph.fs.quoracdn.net/main-qimg-b9426eb8963387a2855b2d76f6cc925e","","","","","","2023-09-12T23:47:20.622Z","2023-09-12T23:47:20.622Z"
"RrzEw7WEQFgQI4ZOq4vv","Mahatma Gandhi","Mohandas Karamchand Gandhi was an Indian lawyer, anti-colonial nationalist, and political ethicist, who employed nonviolent resistance to lead the successful campaign for India's independence from British Rule, and in turn inspire movements for civil rights and freedom across the world.","","","","","","https://en.wikipedia.org/wiki/Mahatma_Gandhi","https://en.wikipedia.org/wiki/Mahatma_Gandhi","","","","2023-09-12T23:47:20.656Z","2023-09-12T23:47:20.656Z"
"RxWbhHYBBYEhorYknVEX","Maxence","Maxence is a fictional character played by Jérémie Covillault in the TV series ""La Révolution"". In the show, he's a priest close to Joseph Guillotin and he believes that everyone deserves to be saved.","","","","Priest","https://firebasestorage.googleapis.com/v0/b/memorare-98eee.appspot.com/o/images%2Fpp%2FMaxence-1604359755808.jpg?alt=media","","https://fr.wikipedia.org/wiki/J%C3%A9r%C3%A9mie_Covillault","true","","","2023-09-12T23:47:20.689Z","2023-09-12T23:47:20.689Z"
"Rzp6wfwy8zN17GztleS4","Vincent van Gogh","Vincent Willem van Gogh was a Dutch post-impressionist painter who is among the most famous and influential figures in the history of Western art. In just over a decade, he created about 2,100 artworks, including around 860 oil paintings, most of which date from the last two years of his life.","","","","Dutch painter","https://upload.wikimedia.org/wikipedia/commons/4/4c/Vincent_van_Gogh_-_Self-Portrait_-_Google_Art_Project_%28454045%29.jpg","","https://en.wikipedia.org/wiki/Vincent_van_Gogh","","","","2023-09-12T23:47:20.724Z","2023-09-12T23:47:20.724Z"
"S2P4XX0WBzeEamIM1mRO","Gus Mancuso","Gus Mancuso is a fictional character played by  Laurence Fishburne in the film ""Passengers"". He plays as the chief deck officer on the Avalon and helps to repair the ship.","","","","Chief Deck Officer","https://firebasestorage.googleapis.com/v0/b/memorare-98eee.appspot.com/o/images%2Fpp%2FGus Mancuso-1615241494757.jpg?alt=media","","https://en.wikipedia.org/wiki/Laurence_Fishburne","true","","","2023-09-12T23:47:20.776Z","2023-09-12T23:47:20.776Z"
"SHqkmeCQaaDuhxY9ATaU","Kobe Bryant","Kobe Bean Bryant was an American professional basketball player. As a shooting guard, Bryant entered the National Basketball Association directly from high school, and played his entire 20-season professional career in the league with the Los Angeles Lakers.","","","","American basketball player","https://upload.wikimedia.org/wikipedia/commons/8/82/Kobe_Bryant_2015.jpg","","https://en.wikipedia.org/wiki/Kobe_Bryant","","","","2023-09-12T23:47:20.813Z","2023-09-12T23:47:20.813Z"
"SJmLzfh6oXaXcNL8RHNE","Jim Rohn","Emanuel James Rohn professionally known as Jim Rohn, was an American entrepreneur, author and motivational speaker.","","","","American entrepreneur","https://images-na.ssl-images-amazon.com/images/I/619YaezqqwL._SY355_.png","","https://en.wikipedia.org/wiki/Jim_Rohn","","","","2023-09-12T23:47:20.845Z","2023-09-12T23:47:20.845Z"
"ST3PqHAzSCTf3sSiAZB1","Satya Nadell","Satya Narayana Nadella is an engineer and Indian American business executive. He is the chief executive officer of Microsoft, succeeding Steve Ballmer in 2014. He led a giant round of layoffs and flattened the organization, getting rid of middle managers.","","","","Chief Executive Officer of Microsoft","https://upload.wikimedia.org/wikipedia/commons/1/19/Satya_smiling-print.jpg","https://twitter.com/satyanadella?ref_src=twsrc%5Egoogle%7Ctwcamp%5Eserp%7Ctwgr%5Eauthor","https://en.wikipedia.org/wiki/Satya_Nadella","","","","2023-09-12T23:47:20.882Z","2023-09-12T23:47:20.882Z"
"SZmGPLc6qial6VpsbenG","Jeremiah Pontelli","Jeremiah Pontelli is a fictional character. Jeremiah the peddler, alias Geraldo Ponti, magician, alias Dr. Jerome DuPont, ""Neuro-Hypnotist"", first met Grace when she was a new housemaid and he was peddling house to house in Toronto. When he called at the Kinnear house, he told her he feared she might be in danger there. He's played by Zachari Levi.","2021-05-03T00:23:44.476Z","2021-05-03T00:23:44.476Z","","Peddler, Magician, Neuro-Hypnotist","https://firebasestorage.googleapis.com/v0/b/memorare-98eee.appspot.com/o/images%2Fpp%2FJeremiah Pontelli-1620483908153.jpg?alt=media","","https://en.wikipedia.org/wiki/Zachary_Levi","","","","2023-09-12T23:47:20.932Z","2023-09-12T23:47:20.932Z"
"SdIrYHd1241RqLqE4PjG","Anita (or) BATESON","","","","","","","","","","","","2023-09-12T23:47:20.962Z","2023-09-12T23:47:20.962Z"
"SfXAthA6opJ1UdDAG3he","Sébastien Frit","Sébastien Frit, plus connu sous le pseudonyme Seb la Frite ou SEB, est un vidéaste français. En août 2018, il est le treizième youtubeur francophone le plus suivi, avec plus de 4 millions d'abonnés pour environ 468 millions de vues.","","","","Video producer","https://yt3.ggpht.com/a/AGF-l7-seWpp6mfQyVQT_fZsUBVmAQnOhW652exgsw=s288-c-k-c0xffffffff-no-rj-mo","https://www.youtube.com/user/SeblaFriteOfficiel","https://fr.wikipedia.org/wiki/Seb_la_Frite","","","","2023-09-12T23:47:21.011Z","2023-09-12T23:47:21.011Z"
"SlLmEkVmQ5XOKCR8Q4Kt","Donatien de Montargis","Donatien de Montargis is a fictional character played by Julien Frison in the TV series ""La Révolution"". In the show, he's Charles' son and has a terrible disease. He's impulsive and seek his father admiration.","","","","Noble","https://firebasestorage.googleapis.com/v0/b/memorare-98eee.appspot.com/o/images%2Fpp%2FDonatien de Montargis-1604357266612.jpg?alt=media","","https://fr.wikipedia.org/wiki/Julien_Frison","true","","","2023-09-12T23:47:21.061Z","2023-09-12T23:47:21.061Z"
"SlrqxRzCQMXtraBcuI7M","Anais Nin","Angela Anaïs Juana Antolina Rosa Edelmira Nin y Culmell, known professionally as Anaïs Nin was a French-Cuban American diarist, essayist, novelist, and writer of short stories and erotica. Born to Cuban parents in France, Nin was the daughter of composer Joaquín Nin and Rosa Culmell, a classically trained singer.","","","","American-Cuban-French essayist","https://upload.wikimedia.org/wikipedia/commons/8/87/George_Leite_and_Ana%C3%AFs_Nin_at_daliel%27s_bookstore_in_Berkeley%2C_CA%2C_1946.jpg","","https://en.wikipedia.org/wiki/Ana%C3%AFs_Nin","","","","2023-09-12T23:47:21.095Z","2023-09-12T23:47:21.095Z"
"SwX1UVW4k7aoCVppuZzn","Adrian Veildt","Adrian Veildt is a fictional character in the 2019 TV series Watchmen, played by Jeremy Irons. He's a former businessman and the vigilante Ozymandias, the ""smartest man in the world"". He is now living as an aristocratic lord of a country manor that turned out to be on Europa.","","","","Businessman","https://firebasestorage.googleapis.com/v0/b/memorare-98eee.appspot.com/o/images%2Fpp%2FJeremy_Irons.jpg?alt=media&token=55692e76-3a4d-4e3f-bbd7-679703b0c810","","https://en.wikipedia.org/wiki/Ozymandias_(Watchmen)","","","","2023-09-12T23:47:21.134Z","2023-09-12T23:47:21.134Z"
"SzqwmYXEA9pt0cF4QILJ","William ""Bill"" Farrah (FANGS)","Bill Farrah is a character in the TV series «A Murder at the End of the World». He's an artist under the name FANGS.","2024-01-22T09:24:18.809Z","2024-01-15T01:27:04.226Z","","","https://firebasestorage.googleapis.com/v0/b/memorare-98eee.appspot.com/o/images%2Fpp%2FWilliam ""Bill"" Farrah (FANGS)-1705915483322.jpg?alt=media","","","true","","","2024-01-22T09:24:34.000Z","2024-01-22T09:24:34.000Z"
"T3A1FpY5RIghvZMaolAF","Napoléon Bonaparte","Napoleon Bonaparte was a French statesman and military leader who led many successful campaigns during the French Revolution and the French Revolutionary Wars, and was Emperor of the French from 1804 until 1814 and again briefly in 1815 during the Hundred Days.","1769-08-14T23:50:39.000Z","1821-05-04T23:50:39.000Z","France","Statesman","https://firebasestorage.googleapis.com/v0/b/memorare-98eee.appspot.com/o/images%2Fpp%2FNapoléon Bonaparte-1604350767998.jpg?alt=media","","https://en.wikipedia.org/wiki/Napoleon","","","","2023-09-12T23:47:22.172Z","2023-09-12T23:47:22.172Z"
"T6i480MSKmFNl9nJTKdg","Ned Stark","Ned Stark is the head of House Stark, Lord of Winterfell, and Warden of the North.","2024-07-22T18:22:59.825Z","2024-07-22T18:20:27.032Z","","","https://firebasestorage.googleapis.com/v0/b/memorare-98eee.appspot.com/o/images%2Fpp%2FNed-Stark-1721672583961.jpg?alt=media","","https://en.wikipedia.org/wiki/Ned_Stark","","","","2024-07-22T18:23:02.754Z","2024-07-22T18:23:02.755Z"
"T7TjbaqCGIUDq4Dot0vQ","Maimonides","Moses ben Maimon, commonly known as Maimonides and also referred to by the acronym Rambam, was a medieval Sephardic Jewish philosopher who became one of the most prolific and influential Torah scholars of the Middle Ages. In his time, he was also a preeminent astronomer and physician.","","","","Philosopher","https://upload.wikimedia.org/wikipedia/commons/0/07/Maimonides-2.jpg","","https://en.wikipedia.org/wiki/Maimonides","","","","2023-09-12T23:47:22.205Z","2023-09-12T23:47:22.205Z"
"TFYXoXUFbFZ0TXqWVduy","Albert Einstein & Leopold Infeld","Albert Einstein was a German-born theoretical physicist who developed the theory of relativity, one of the two pillars of modern physics. Leopold Infeld was a Polish physicist who worked mainly in Poland and Canada.","","","","","","","","","","","2023-09-12T23:47:22.239Z","2023-09-12T23:47:22.239Z"
"TK2UzGVsNaJy2AlJf0fV","Blaise Pascal","Blaise Pascal was a French mathematician, physicist, inventor, writer and Catholic theologian. He was a child prodigy who was educated by his father, a tax collector in Rouen.","","","","French mathematician","https://upload.wikimedia.org/wikipedia/commons/9/98/Blaise_Pascal_Versailles.JPG","","https://en.wikipedia.org/wiki/Blaise_Pascal","","","","2023-09-12T23:47:22.291Z","2023-09-12T23:47:22.291Z"
"TSpqGWKX09kbXWLaa5P3","Les Brown","Leslie Calvin ""Les"" Brown is an American motivational speaker, author, former radio DJ, and former television host. He was a member of the Ohio House of Representatives from 1976 to 1981. As a motivational speaker, he uses the catch phrase ""it's possible!"" to encourage people to follow their dreams.","","","","American author","https://upload.wikimedia.org/wikipedia/commons/9/91/Les_Brown_speaking.jpg","","https://en.wikipedia.org/wiki/Les_Brown_(speaker)","","","","2023-09-12T23:47:22.337Z","2023-09-12T23:47:22.337Z"
"TXp5frjlCJnqdTS0stQu","Richard Feynman","American theoretical physicist, known for his work in the path integral formulation of quantum mechanics, the theory of quantum electrodynamics, and the physics of the superfluidity of supercooled liquid helium, as well as in particle physics for which he proposed the parton model.","","","","","https://upload.wikimedia.org/wikipedia/en/4/42/Richard_Feynman_Nobel.jpg","https://en.wikipedia.org/wiki/Richard_Feynman","https://en.wikipedia.org/wiki/Richard_Feynman","","","","2023-09-12T23:47:22.370Z","2023-09-12T23:47:22.370Z"
"TauYleubW4hYqq5V6Zbc","Jane Margolis & Yasmin Kafai","Jane's research focuses on equity in education and how fields become segregated. Yasmin's work empowers students to use computer programming to design games, electronic textiles, and biological applications to promote coding, crafting, and creativity across grades K–16.","","","","","","https://www.tandfonline.com/doi/abs/10.1080/10665684.2018.1436998","https://www.tandfonline.com/doi/abs/10.1080/10665684.2018.1436998","","","","2023-09-12T23:47:22.404Z","2023-09-12T23:47:22.404Z"
"TjV4NUFZm9iA7uKGnw6F","Stephen Fry","Stephen John Fry is an English actor, comedian and writer. He and Hugh Laurie are the comic double act Fry and Laurie, who starred in A Bit of Fry & Laurie and Jeeves and Wooster.","","","","Actor","https://upload.wikimedia.org/wikipedia/commons/3/38/Stephen_Fry_June_2016.jpg","http://www.stephenfry.com/","https://en.wikipedia.org/wiki/Stephen_Fry","","","","2023-09-12T23:47:22.442Z","2023-09-12T23:47:22.442Z"
"Tuj0Ovbhy569DnaY0Mgd","Anatole France","Anatole France was a French poet, journalist, and novelist with several best-sellers. Ironic and skeptical, he was considered in his day the ideal French man of letters.","","","","French poet","https://upload.wikimedia.org/wikipedia/commons/c/c1/Anatole_France_young_years.jpg","","https://en.wikipedia.org/wiki/Anatole_France","","","","2023-09-12T23:47:22.477Z","2023-09-12T23:47:22.477Z"
"TwDAwxgSaMiakR8RsRgN","Christian Longo","Christian Michael Longo is a convicted murderer who committed his crimes in the U.S. state of Oregon. Originating from Ypsilanti Township, Michigan, he married Mary Jane Baker at age 19 and they had three children together. He and his family often encountered financial difficulties due to his reckless spending habits.","","","","Convicted murderer","https://firebasestorage.googleapis.com/v0/b/memorare-98eee.appspot.com/o/images%2Fpp%2FChristian%20Longo.png?alt=media&token=9d709a6f-5c77-4e48-b997-44abc4f2547c","","https://en.wikipedia.org/wiki/Christian_Longo","","","","2023-09-12T23:47:22.512Z","2023-09-12T23:47:22.512Z"
"TySUhQPqndIkiVHWVYq1","Anonymous","A anonymous person who doesn't want to be known.","","","","Unkown","","","","","","","2023-09-12T23:47:22.546Z","2023-09-12T23:47:22.546Z"
"TzWUOydXqPUwLI39Bj8c","Inspector Ronan","Fictional character in the TV series 'Marianne'. He's charged to investigate on the deaths of some citizens.","","","","Polic Inspector","","","https://en.wikipedia.org/wiki/Marianne_(TV_series)","","","","2023-09-12T23:47:22.583Z","2023-09-12T23:47:22.583Z"
"U5Uo4tcTfwT9u8vix2X2","Sue Snell","Susan D. Snell is a fictional character created by American author Stephen King in his first published 1974 horror novel, Carrie. She is a popular teenage girl dating Tommy Ross. After tormenting Carrie White in the locker room, Sue begins to feel remorse for her actions.","","","","Teenager","https://firebasestorage.googleapis.com/v0/b/memorare-98eee.appspot.com/o/images%2Fpp%2F Sue Snell-1615244670070.jpg?alt=media","","https://en.wikipedia.org/wiki/Sue_Snell","true","","","2023-09-12T23:47:22.616Z","2023-09-12T23:47:22.616Z"
"U8PL1VwxfF7FZb44CY7m","Latin Proverb","","","","","","","","","","","","2023-09-12T23:47:22.650Z","2023-09-12T23:47:22.650Z"
"UAnEuMsAb8lrYB4onvMO","Nikola Tesla","Nikola Tesla was a Serbian-American inventor, electrical engineer, mechanical engineer, and futurist who is best known
 for his contributions to the design of the modern alternating current electricity supply system.","","","","Inventor","https://upload.wikimedia.org/wikipedia/commons/d/d4/N.Tesla.JPG","","https://en.wikipedia.org/wiki/Nikola_Tesla","","","","2023-09-12T23:47:22.682Z","2023-09-12T23:47:22.682Z"
