firebase_id,name,bio,birth_date,death_date,nationality,job,image_url,website_url,wikipedia_url,is_fictional,views_count,quotes_count,created_at,updated_at
"jN3BJpmDsAXbR3jHRxZD","Robert Henri","Robert Henri was an American painter and teacher. He was a leading figure of the Ashcan School of American realism and an organizer of the group known as ""The Eight,"" a loose association of artists who protested the restrictive exhibition practices of the powerful, conservative National Academy of Design.","","","","American painter","https://uploads3.wikiart.org/images/robert-henri(1).jpg","","https://en.wikipedia.org/wiki/Robert_Henri","","","","2023-09-12T23:47:25.586Z","2023-09-12T23:47:25.586Z"
"jP7FJUkQ3MMWvcXDnPiv","Granny (Celia)","Granny is a fictional character in the video game Celeste. She's an old lady who warn Madeline about the degerous powers of the Celeste Mountain. She lives at the base of this mountain.","","","","Inhabitant","https://firebasestorage.googleapis.com/v0/b/memorare-98eee.appspot.com/o/images%2Fpp%2FGranny (Celia)-1610064909991.png?alt=media","","https://en.wikipedia.org/wiki/Celeste_(video_game)","true","","","2023-09-12T23:47:25.622Z","2023-09-12T23:47:25.622Z"
"jQYnd5SJUjQcSgJTXbHB","Erma Bombeck","Erma Louise Bombeck was an American humorist who achieved great popularity for her newspaper column that described suburban home life from the mid-1960s until the late 1990s. Bombeck also published 15 books, most of which became bestsellers.","","","","American humorist","https://upload.wikimedia.org/wikipedia/en/e/e6/Erma_Bombeck.jpg","","https://en.wikipedia.org/wiki/Erma_Bombeck","","","","2023-09-12T23:47:25.655Z","2023-09-12T23:47:25.655Z"
"jR70tM17wY1nNWgDYuET","Stewart Brand","Stewart Brand is an American writer, best known as editor of the Whole Earth Catalog. He founded a number of organizations, including The WELL, the Global Business Network, and the Long Now Foundation. He is the author of several books, most recently Whole Earth Discipline: An Ecopragmatist Manifesto.","1938-12-14T00:00:00.000Z","","United States","American writer","https://firebasestorage.googleapis.com/v0/b/memorare-98eee.appspot.com/o/images%2Fpp%2FStewart Brand-1610065164397.jpg?alt=media","http://sb.longnow.org/SB_homepage/Home.html","https://en.wikipedia.org/wiki/Stewart_Brand","","","","2023-09-12T23:47:25.692Z","2023-09-12T23:47:25.692Z"
"jTOdeok0ZFwYC8QMIf56","Vincent van Gogh","Vincent Willem van Gogh was a Dutch post-impressionist painter who posthumously became one of the most famous and influential figures in the history of Western art. In a decade, he created about 2,100 artworks, including around 860 oil paintings, most of which date from the last two years of his life.","1853-03-29T22:00:00.000Z","1890-07-28T22:00:00.000Z","Netherlands","Dutch painter","https://firebasestorage.googleapis.com/v0/b/memorare-98eee.appspot.com/o/images%2Fpp%2FVincent van Gogh-1621856462652.jpg?alt=media","https://www.vangoghmuseum.nl/en","https://en.wikipedia.org/wiki/Vincent_van_Gogh","","","","2023-09-12T23:47:25.726Z","2023-09-12T23:47:25.726Z"
"jVzKJcTzMRO44bn6VPz9","ZeratoR","ZeratoR, alias Adrien Nougaret, is a french streamer, animator, and content producer specialized in video games. He career started in 2010 at aAa company, and became independant in January 2015.

He streams mainly on Twitch and published VOD on YouTube. He organizes and comments E-Sport events, charitable events (Z Event), and he owns a video games company called Unexpected.","1990-02-28T23:00:00.000Z","2021-03-21T00:51:02.146Z","France","Streamer","https://firebasestorage.googleapis.com/v0/b/memorare-98eee.appspot.com/o/images%2Fpp%2FZeratoR-1619989827655.jpg?alt=media","https://zerator.com/","https://fr.wikipedia.org/wiki/ZeratoR","","","","2023-09-12T23:47:25.759Z","2023-09-12T23:47:25.759Z"
"jWyaddRYf9zZMT60SaGI","Rebecca Webb","Rebecca Webb is a geneticist and a CEO in the TV series ""The One"".","","","","Geneticist","https://firebasestorage.googleapis.com/v0/b/memorare-98eee.appspot.com/o/images%2Fpp%2FRebecca Webb-1617369335573.jpg?alt=media","","https://en.wikipedia.org/wiki/Hannah_Ware","","","","2023-09-12T23:47:25.796Z","2023-09-12T23:47:25.796Z"
"jZoIk3uLOTBYxkUsbydE","Stephen Covey","Stephen Richards Covey was an American educator, author, businessman, and keynote speaker. His most popular book is The 7 Habits of Highly Effective People.","","","","American educator","https://upload.wikimedia.org/wikipedia/commons/6/6d/Stephen_Covey_2010.jpg","","https://en.wikipedia.org/wiki/Stephen_Covey","","","","2023-09-12T23:47:25.830Z","2023-09-12T23:47:25.830Z"
"jicOr9kVplfb2ceWloZB","Le Renard","«Le renard» (The fox) is a fictional character in the novel «Le Petit Prince». The fox teaches the prince that his rose is special because she is the object of the prince's love and time. Because he had ""tamed"" her, she's more precious than all of the other roses.

The fox also says that important things can only be seen with the heart, not the eyes.","2023-12-09T14:00:20.114Z","2023-08-09T14:25:28.959Z","","","https://firebasestorage.googleapis.com/v0/b/memorare-98eee.appspot.com/o/images%2Fpp%2FLe Renard-1702130435299.jpg?alt=media","","https://en.wikipedia.org/wiki/The%20Little%20Prince","true","","","2023-12-09T14:00:29.595Z","2023-12-09T14:00:29.595Z"
"kCJAQGMjrzCkOKlnlzQU","Neale Donald Walsch","Neale Donald Walsch is an American author of the series Conversations with God. He is also an actor, screenwriter, and speaker.","","","","American author","https://upload.wikimedia.org/wikipedia/commons/e/e7/Neale_Donald_Walsch.jpg","http://www.nealedonaldwalsch.com/","https://en.wikipedia.org/wiki/Neale_Donald_Walsch","","","","2023-09-12T23:47:25.866Z","2023-09-12T23:47:25.866Z"
"kUQ1xFFOQbfFAiEUL7lo","Miles","Miles is a fictional character issued by Jack Black in the film ""The Holiday"". He is a Hollywood music composer working with Amanda and an affiliate of her boyfriend Ethan.","","","","Compositor","https://upload.wikimedia.org/wikipedia/commons/7/74/Jack_Black_2_2011.jpg","","https://en.wikipedia.org/wiki/Jack_Black","","","","2023-09-12T23:47:25.923Z","2023-09-12T23:47:25.923Z"
"kYha1tS4c9Vo4T2qVjC6","Nelson Mandela","Nelson Rolihlahla Mandela was a South African anti-apartheid activist and politician who served as the first president of South Africa from 1994 to 1999. He was the country's first black head of state and the first elected in a fully representative democratic election.","2024-01-03T10:54:08.582Z","2013-12-04T23:00:00.000Z","","Former President of South Africa","https://firebasestorage.googleapis.com/v0/b/memorare-98eee.appspot.com/o/images%2Fpp%2FNelson Mandelak-1704279268988.jpg?alt=media","","https://en.wikipedia.org/wiki/Nelson_Mandela","","","","2024-01-03T10:54:20.798Z","2024-01-03T10:54:20.798Z"
"kdyz969bgR6uRw0z6Ypl","Valery Legasov","Valery Legasov is a character played by Jared Harris in the TV series ""Chernobyl"". In the show, he's the deputy director of the Kurchatov Institute brought in to aid cleanup efforts. This character really existed.","1936-08-31T23:00:00.000Z","1988-04-21T22:00:00.000Z","Russia, Soviet Union","Inorganic chemist","https://firebasestorage.googleapis.com/v0/b/memorare-98eee.appspot.com/o/images%2Fpp%2FValery Legasov-1604527872729.jpg?alt=media","","https://en.wikipedia.org/wiki/Valery_Legasov","true","","","2023-09-12T23:47:25.961Z","2023-09-12T23:47:25.961Z"
"kqdpXXR7Vs5GFNWvwHqA","Shanti","Shanti is Maëlle's guide in the book «Kilomètre zéro». They travel through Annapurnas mountains in Népal in order to retrieve a book. During the journey, Shanti has several conversations with Maëlle about happiness, emotions, reality perception, expectations.","2024-01-06T11:44:10.049Z","2024-01-06T11:32:48.479Z","","Guide, carrier, tour guide","","","","true","","","2024-01-06T11:44:21.053Z","2024-01-06T11:44:21.053Z"
"kyTeJsMjjInwFCMCUcM4","Ben Frémont's grandfather","Ben's grandfather is mentioned briefly in the book about his love for his wife.","","","","","","","","true","","","2023-09-12T23:47:26.001Z","2023-09-12T23:47:26.001Z"
"kzBZlyOoaggOMlAP7fse","W. Clement Stone","William Clement Stone was a businessman, philanthropist and New Thought self-help book author.","","","","Businessman","https://images-na.ssl-images-amazon.com/images/I/81h2i4S145L._UX250_.jpg","","https://en.wikipedia.org/wiki/W._Clement_Stone","","","","2023-09-12T23:47:26.035Z","2023-09-12T23:47:26.035Z"
"lOaHLDjAVdIfxIBrVppa","Adam Bell","Adam Bell is a fictional character played by Jake Gyllenhaal in the film Enemy. ","","","","History professor","https://upload.wikimedia.org/wikipedia/commons/0/0e/Jake_Gyllenhaal_2019_by_Glenn_Francis.jpg","","https://en.wikipedia.org/wiki/Jake_Gyllenhaal","","","","2023-09-12T23:47:26.072Z","2023-09-12T23:47:26.072Z"
"lRWKb9Hf4u4f1I7oS1r4","Sophocles","Sophocles (c. 497/496 – winter 406/405 BC) was an ancient Greek tragedian, known as one of three from whom at least one play has survived in full. Sophocles wrote over 120 plays, but only seven have survived in a complete form: Ajax, Antigone, Women of Trachis, Oedipus Rex, Electra, Philoctetes, and Oedipus at Colonus. 

For almost fifty years, Sophocles was the most celebrated playwright in the dramatic competitions of the city-state of Athens which took place during the religious festivals of the Lenaea and the Dionysia. He competed in thirty competitions, won twenty-four, and was never judged lower than second place. Aeschylus won thirteen competitions, and was sometimes defeated by Sophocles; Euripides won four.","2024-01-02T11:50:18.914Z","0406-01-01T23:00:00.000Z","","5th century BC Athenian tragic playwright","https://firebasestorage.googleapis.com/v0/b/memorare-98eee.appspot.com/o/images%2Fpp%2FSophocles-1704196226589.jpg?alt=media","","https://en.wikipedia.org/wiki/Sophocles","","","","2024-01-02T11:50:24.547Z","2024-01-02T11:50:24.547Z"
"lcjCnd7hIrd262WM6MMn","Jérémie CORPINOT","French developer and tech enthusiast.","","","","","https://pbs.twimg.com/profile_images/744898981583454208/2q2KOYz0_400x400.jpg","https://twitter.com/jeremiecorpinot","https://twitter.com/jeremiecorpinot","","","","2023-09-12T23:47:26.107Z","2023-09-12T23:47:26.107Z"
"ldlNL1YgBd4OkfNjGLhd","Léo Grasset","Léo Grasset, born in 1989 at Saint-Étienne, is a french video producer and writer. He's mainly known for his YouTube channel, DirtyBiology, started in June
 2014.","","","","Video producer, Writer","https://upload.wikimedia.org/wikipedia/commons/b/b3/L%C3%A9o_Grasset%2C_en_conf%C3%A9rence_%282017%29.jpg","https://www.youtube.com/user/dirtybiolog","https://fr.wikipedia.org/wiki/L%C3%A9o_Grasset","","","","2023-09-12T23:47:26.142Z","2023-09-12T23:47:26.142Z"
"lnmbSHTAvOgFNBHug0kz","Nathaniel Hawthorne","Nathaniel Hawthorne was an American novelist, dark romantic, and short story writer. His works often focus on history, morality, and religion. He was born in 1804 in Salem, Massachusetts, to Nathaniel Hathorne and the former Elizabeth Clarke Manning.","1804-07-03T22:00:00.000Z","1864-05-18T22:00:00.000Z","United States","American novelist","https://firebasestorage.googleapis.com/v0/b/memorare-98eee.appspot.com/o/images%2Fpp%2FNathaniel Hawthorne-1619986476534.jpg?alt=media","","https://en.wikipedia.org/wiki/Nathaniel_Hawthorne","","","","2023-09-12T23:47:26.177Z","2023-09-12T23:47:26.177Z"
"lq7OVlhEKpkKqLnFD63I","Anna Lappé","Anna Lappé is an American author and educator, known for her work as an expert on food systems and as a sustainable food advocate.","1972-12-31T23:00:00.000Z","2021-03-20T14:26:23.249Z","United States","American author","https://firebasestorage.googleapis.com/v0/b/memorare-98eee.appspot.com/o/images%2Fpp%2FAnna Lappé-1619991291595.jpg?alt=media","https://annalappe.com/","https://en.wikipedia.org/wiki/Anna_Lappé","","","","2023-09-12T23:47:26.211Z","2023-09-12T23:47:26.211Z"
"lsUT6aimE6KPU2HPj9A5","Le Rire Jaune (duo)","Le Rire Jaune is two french YouTubers, Kevin Kē Wěi Tran and Henry Kē Liáng Tran, which make humorous sketches videos on YouTube.","","","","YouTuber","https://firebasestorage.googleapis.com/v0/b/memorare-98eee.appspot.com/o/images%2Fpp%2FLe_Rire_Jaune.jpg?alt=media&token=aef2303c-4ae7-417e-bb5a-e34661e1b727","","https://fr.wikipedia.org/wiki/Le_Rire_Jaune_(duo)","","","","2023-09-12T23:47:26.266Z","2023-09-12T23:47:26.266Z"
"m6a32WUtyplxY20hngSa","Anna Akana","Anna Kay Akana is an American actress, filmmaker, musician, author, and comedian.","","","","","","https://en.wikipedia.org/wiki/Anna_Akana","https://en.wikipedia.org/wiki/Anna_Akana","","","","2023-09-12T23:47:26.306Z","2023-09-12T23:47:26.306Z"
"mJ4mqUZGUhLbJnJdJ3MJ","Scar","Scar is a fictional character and the main antagonist in Disney's The Lion King franchise. He was created by screenwriters Irene Mecchi, Jonathan Roberts and Linda Woolverton, and animated by Andreas Deja. Scar is introduced in the first film as the ruthless, power-hungry younger brother of Mufasa, ruler of the Pride Lands. Originally first in line to Mufasa's throne until he is suddenly replaced by Mufasa's son Simba, Scar decides to lead an army of hyenas in his plot to take the throne by killing Mufasa and Simba, who escapes into exile, ultimately blaming his brother's death on his nephew.","2024-07-22T14:20:31.210Z","2024-07-22T14:16:32.210Z","","","https://firebasestorage.googleapis.com/v0/b/memorare-98eee.appspot.com/o/images%2Fpp%2FScar-1721658046627.png?alt=media","","https://en.m.wikipedia.org/wiki/Scar_(The_Lion_King)","true","","","2024-07-22T14:20:41.068Z","2024-07-22T14:20:41.068Z"
"mPd6tBCZ2KQJphzhpN3H","Anne Frank","Annelies Marie ""Anne"" Frank was a German-born Dutch-Jewish diarist. One of the most discussed Jewish victims of the Holocaust, she gained fame posthumously with the publication of The Diary of a Young Girl (originally Het Achterhuis in Dutch; English: The Secret Annex), in which she documents her life in hiding from 1942 to 1944, during the German occupation of the Netherlands in World War II. It is one of the world's best known books and has been the basis for several plays and films.","","","","German diarist","https://upload.wikimedia.org/wikipedia/commons/a/a4/AnneFrank1940_crop.jpg","","https://en.wikipedia.org/wiki/Anne_Frank","","","","2023-09-12T23:47:26.340Z","2023-09-12T23:47:26.340Z"
"mWKwFlt1avd21h87oNUk","Calisto","Calisto – alias Cal – is a fictional character played by Jane Frances Kaczmarek in the tv series The Changeling.

She's the leader of the community ""The Wise Ones"" living on the North Brother Island.","2023-10-23T14:28:52.341Z","2023-10-23T14:03:05.009Z","","The Wise Ones leader","https://firebasestorage.googleapis.com/v0/b/memorare-98eee.appspot.com/o/images%2Fpp%2FCalisto-1698071352200.png?alt=media","","","true","","","2023-10-23T14:29:06.387Z","2023-10-23T14:29:06.387Z"
"mXsDhdSWWnN27SCVuefD","Vernon Law","Vernon Sanders ""Vern"" Law is an American former baseball pitcher who played sixteen seasons in Major League Baseball for the Pittsburgh Pirates. He played in 1950–51 and 1954–67. He batted and threw right-handed and was listed at 6 feet 2 inches and 195 pounds.","","","","Baseball pitcher","https://upload.wikimedia.org/wikipedia/commons/5/58/Vern_Law_%285405222334%29_%28cropped%29.jpg","","https://en.wikipedia.org/wiki/Vern_Law","","","","2023-09-12T23:47:26.375Z","2023-09-12T23:47:26.375Z"
"moZRjo7LQssmTaZiUiMC","Jean-Marie Roth","Passionate about the secrets of dramaturgy, Jean-Marie Roth is the author of L'écriture de scénarios, considered a reference by professionals and students alike. He is also the author of the only lexicon dedicated to the profession: Le lexique du scénariste.","2024-01-19T17:48:14.842Z","2023-08-01T19:40:09.029Z","","Author","https://firebasestorage.googleapis.com/v0/b/memorare-98eee.appspot.com/o/images%2Fpp%2FJean-Marie Roth-1705686502535.jpg?alt=media","","","","","","2024-01-19T17:48:21.399Z","2024-01-19T17:48:21.399Z"
"mtL7VC0PN64ndVRt6Qh6","Joe Black (Film)","Joe Black is a fictional character played by Brad Pitt in the film ""Meet Joe Black"".","","","","","https://firebasestorage.googleapis.com/v0/b/memorare-98eee.appspot.com/o/images%2Fpp%2FBrad%20Pitt.jpg?alt=media&token=452f6128-66a6-4d94-abf0-5a052d4fa95b","","https://en.wikipedia.org/wiki/Brad_Pitt","","","","2023-09-12T23:47:26.408Z","2023-09-12T23:47:26.408Z"
"mtcEEpPYGasbVYk34FD4","Edward Snowden","Edward Joseph Snowden is an American whistleblower who copied and leaked highly classified information from the National Security Agency in 2013 when he was a Central Intelligence Agency employee and subcontractor.","","","","American journalist","https://upload.wikimedia.org/wikipedia/commons/6/60/Edward_Snowden-2.jpg","https://www.edwardsnowden.com","https://en.wikipedia.org/wiki/Edward_Snowden","","","","2023-09-12T23:47:26.439Z","2023-09-12T23:47:26.439Z"
"n1FyOV55yjo7v4eKDESg","Jean Racine","Jean-Baptiste Racine was a French dramatist, one of the three great playwrights of 17th-century France, along with Molière and Corneille as well as an important literary figure in the Western tradition and world literature.","2024-01-19T18:26:13.631Z","1699-04-20T22:00:00.000Z","","17th-century French dramatist","https://firebasestorage.googleapis.com/v0/b/memorare-98eee.appspot.com/o/images%2Fpp%2FJean Racine-1705688780868.jpg?alt=media","","https://en.wikipedia.org/wiki/Jean_Racine","","","","2024-01-19T18:26:19.519Z","2024-01-19T18:26:19.519Z"
"nJkdiTaAE4slwQMkXdWI","Dalai Lama","The 14th Dalai Lama is the current Dalai Lama. Dalai Lamas are important monks of the Gelug school, the newest school of Tibetan Buddhism, which was formally headed by the Ganden Tripas.","","","","Monk","https://upload.wikimedia.org/wikipedia/commons/3/30/Dalai_Lama_in_2012_02.jpg","","https://en.wikipedia.org/wiki/14th_Dalai_Lama","","","","2023-09-12T23:47:26.473Z","2023-09-12T23:47:26.473Z"
"nK3mhU6SnTLZpGepFZLU","Thich Nhat Hanh","Thích Nhất Hạnh is a Vietnamese Buddhist monk and peace activist, founder of the Plum Village Tradition. Thích Nhất Hạnh spent most of his later life residing in the Plum Village Monastery in southwest France, travelling internationally to give retreats and talks.","","","","Vietnamese monk","https://upload.wikimedia.org/wikipedia/commons/1/1b/Thich_Nhat_Hanh_12_%28cropped%29.jpg","","https://en.wikipedia.org/wiki/Th%C3%ADch_Nh%E1%BA%A5t_H%E1%BA%A1nh","","","","2023-09-12T23:47:26.516Z","2023-09-12T23:47:26.516Z"
"nP44PYDEixIpQv0ODuen","Emily Dickinson","Emily Elizabeth Dickinson was an American poet. Little known during her life, she has since been regarded as one of the most important figures in American poetry. Dickinson was born in Amherst, Massachusetts into a prominent family with strong ties to its community. ","1830-12-09T23:00:00.000Z","1886-05-14T22:00:00.000Z","United States","American poet","https://firebasestorage.googleapis.com/v0/b/memorare-98eee.appspot.com/o/images%2Fpp%2FEmily Dickinson-1619986469905.png?alt=media","","https://en.wikipedia.org/wiki/Emily_Dickinson","","","","2023-09-12T23:47:26.548Z","2023-09-12T23:47:26.548Z"
"nRVzLVVP0H2ZtyjU4Fpj","Aurora Lane","Aurora Lane is a fictional character played by Jennifer Lawrence in the film ""Passengers"". She plays as a colonist on The Avalon, a sleeper ship.","","","","Journalist, Writer","https://firebasestorage.googleapis.com/v0/b/memorare-98eee.appspot.com/o/images%2Fpp%2FAurora Lane-1615230438569.jpg?alt=media","","https://en.wikipedia.org/wiki/Jennifer_Lawrence","true","","","2023-09-12T23:47:26.582Z","2023-09-12T23:47:26.582Z"
"nRuIpYuH7GPDbYFBFhzB","Dorothy Parker","Dorothy Parker was an American poet, writer, critic, wit, and satirist based in New York; she was known for her caustic wisecracks, and eye for 20th-century urban foibles.","2024-01-19T18:15:33.154Z","1967-06-06T23:00:00.000Z","","American poet and writer","https://firebasestorage.googleapis.com/v0/b/memorare-98eee.appspot.com/o/images%2Fpp%2FDorothy Parker-1705688139044.jpg?alt=media","","https://en.wikipedia.org/wiki/Dorothy_Parker","","","","2024-01-19T18:15:37.238Z","2024-01-19T18:15:37.238Z"
"nV81YI5rA2A5r4hN2SUx","mistermv","Xiavier Dang, known as mistermv, is a french streamer, video content producer, presentator and music artist. He's specialized in video games and speedrun. He started music in the 1990s and his streaming career in the early 2010s.","","","","Streamer","https://firebasestorage.googleapis.com/v0/b/memorare-98eee.appspot.com/o/images%2Fpp%2Fmistermv-1604580113084.jpg?alt=media","https://quiveutdesgoodies.com/","https://fr.wikipedia.org/wiki/Xavier_Dang","","","","2023-09-12T23:47:26.616Z","2023-09-12T23:47:26.616Z"
"nVz8PcdEBd5SKEzPjKgp","Bruce","Bruce is a lawyer in the miniseries Unbelievable.","","","","","","https://en.wikipedia.org/wiki/Unbelievable_(miniseries)","https://en.wikipedia.org/wiki/Unbelievable_(miniseries)","","","","2023-09-12T23:47:26.671Z","2023-09-12T23:47:26.671Z"
"nxARD0RK2lN2awyjeyOZ","Audrey Hepburn","Audrey Hepburn was a British actress and humanitarian. Recognised as a film and fashion icon, she was ranked by the American Film Institute as the third-greatest female screen legend in Golden Age Hollywood, and was inducted into the International Best Dressed List Hall of Fame.","","","","Actress","https://upload.wikimedia.org/wikipedia/commons/5/5e/Audrey_Hepburn_1956.jpg","","https://en.wikipedia.org/wiki/Audrey_Hepburn","","","","2023-09-12T23:47:26.711Z","2023-09-12T23:47:26.711Z"
"oAkFEmkfjEP7B5Ku77ll","Chrisjen Avasarala","Chrisjen Avasarala	is a UN Deputy Undersecretary of Executive Administration of Earth in the TV series The Expanse.

She's played by Shohreh Aghdashloo.","2023-11-10T13:50:50.328Z","2023-10-24T23:26:36.098Z","","UN Deputy Undersecretary of Executive Administration, later UN Secretary-General","https://firebasestorage.googleapis.com/v0/b/memorare-98eee.appspot.com/o/images%2Fpp%2FChrisjen Avasarala-1699624274809.jpg?alt=media","","https://en.wikipedia.org/wiki/Shohreh_Aghdashloo","true","","","2023-11-10T13:51:08.623Z","2023-11-10T13:51:08.623Z"
"oJzJ8OHoBDuLweHPrY6d","Janelle Monáe","Janelle Monáe Robinson is an American singer, songwriter, rapper and actress. She has received ten Grammy Award nominations, and won a Screen Actors Guild Award and a Children's and Family Emmy Award.

Monáe has a mezzo-soprano voice. Her musical styles have been described as ""a soaring orchestral trip enlivened with blockbuster vocals, mysterious imagery and notes of Sixties pop and jazz"". More succintly: R&B, Pop, Funk, Psychedelic, Soul.

Monáe has also ventured into acting, first gaining attention for starring in the 2016 films Moonlight and Hidden Figures. She has since starred in the films Harriet (2019) and Glass Onion (2022), and the television series Homecoming (2020).","2023-12-09T13:32:05.381Z","2023-12-09T13:14:13.006Z","","American singer-songwriter and rapper","https://firebasestorage.googleapis.com/v0/b/memorare-98eee.appspot.com/o/images%2Fpp%2FJanelle Monáe-1702128813070.jpg?alt=media","http://www.jmonae.com/","https://en.wikipedia.org/wiki/Janelle_Mon%C3%A1e","","","","2023-12-09T13:33:26.728Z","2023-12-09T13:33:26.728Z"
"oOV9aJh2iTXLUqEYqpmM","Elon Musk","Elon Reeve Musk FRS is a technology entrepreneur, investor, and engineer.","","","","","","https://en.wikipedia.org/wiki/Elon_Musk","https://en.wikipedia.org/wiki/Elon_Musk","","","","2023-09-12T23:47:26.744Z","2023-09-12T23:47:26.744Z"
"oPsmH32m6NTy92aTnXto","Rosa Luxemburg","Rosa Luxemburg was a Polish Marxist theorist, philosopher, economist, anti-war activist and revolutionary socialist who became a naturalized German citizen at the age of 28.","","","","","","https://en.wikipedia.org/wiki/Rosa_Luxemburg","https://en.wikipedia.org/wiki/Rosa_Luxemburg","","","","2023-09-12T23:47:26.795Z","2023-09-12T23:47:26.795Z"
"oQ2p2jAMAqBQk4ff646B","Zühre","Zühre is a fictional character played by Meral Çetinkaya in the TV series ""Atiye (The Gift)"". In the show, she's Atiye's grandmother.","","","","Grandmother","https://firebasestorage.googleapis.com/v0/b/memorare-98eee.appspot.com/o/images%2Fpp%2FZühre-1604423033229.jpg?alt=media","","https://en.wikipedia.org/wiki/Meral_%C3%87etinkaya","true","","","2023-09-12T23:47:26.830Z","2023-09-12T23:47:26.830Z"
"obFVeTUvNcaik6pgydnE","Grandma Moses","Anna Mary Robertson Moses, known by her nickname Grandma Moses, was an American folk artist. She began painting in earnest at the age of 78 and is often cited as an example of an individual who successfully began a career in the arts at an advanced age.","","","","American folk artist","https://upload.wikimedia.org/wikipedia/commons/a/ab/Grandma_Moses_NYWTS.jpg","","https://en.wikipedia.org/wiki/Grandma_Moses","","","","2023-09-12T23:47:26.868Z","2023-09-12T23:47:26.868Z"
"ogTmOmcGUQ4PRLRPF4RR","Brian Shelby","Brian Shelby is a fictional character played by Jason Lee in the film ""Vanilla Sky"". Brian is David's friend and want to live as a writer. One day, he introduces one of his friend, Sofia Serrano, to David.","","","","Writer","https://firebasestorage.googleapis.com/v0/b/memorare-98eee.appspot.com/o/images%2Fpp%2FBrian Shelby-1614728624646.jpg?alt=media","","https://en.wikipedia.org/wiki/Jason_Lee_(actor)","true","","","2023-09-12T23:47:26.903Z","2023-09-12T23:47:26.903Z"
"ondfSf1eeqMZFwHQXxFG","Sheldon Cooper","Sheldon Cooper is a theoretical physicist known for his social ineptitude and catchphrase.","2024-07-22T18:37:38.664Z","2024-07-22T18:35:09.894Z","","","https://firebasestorage.googleapis.com/v0/b/memorare-98eee.appspot.com/o/images%2Fpp%2FSheldon-Cooper--1721673462908.jpg?alt=media","","https://en.wikipedia.org/wiki/Sheldon_Cooper","true","","","2024-07-22T18:37:41.628Z","2024-07-22T18:37:41.628Z"
